{"attempt":1,"cache":{"miss":{}},"commandId":"cmd-thumbnail-doc-9","dependencyToken":"sha256:942f508c0e6bde5982e0c6bab4c8572df706436ecfb768a22e8262172a9d9670","dispatch":"sha256:84a2837a1580544fd6e6e75d44236a4218c5ff2a7deef2605619b063bc3cce0f","executionProfile":"sha256:17272cf4d1ef9e0a459e8e8c41e22173501732684ecf0eb38266b5c16f2a3c42","inputIdentity":"sha256:5a5c2c5faeb65a998831f90b156c17bde829704e82e596e75ef85a8f86979176","manifest":"sha256:e9b48ba309ef6a6f1805325774365daf06d3d30a32d4e4bbba4b845599541cb2","outcome":{"success":{"outputManifest":"sha256:fab5de6bf37dd1b12560c1dd83b56954dcf43e884f92bacc14d936a98195f1a4","outputs":[{"digest":"sha256:5d100fa480d3e417757185bb1e500fe159eb222b235aa995bce687b8f0a91672","name":"thumbnail","sizeBytes":48213}],"summary":{"format":"webp","height":171,"width":256}}},"provenance":{"executor":"pool.containers.eu-1","placement":"pool-eu-1/node-b","runtime":"sha256:cd0d46e0e45fe159fb6ed94b0b9992c4b0be049af9d5f5f9fa89f11e7d5abb67"},"resources":{"cpuMillis":410,"fuel":null,"outputBytes":48213,"peakMemoryBytes":94371840,"wallMillis":655},"run":{"generation":1,"id":"run-cmd-thumbnail-doc-9"}}
