{"attempt":1,"cache":{"miss":{}},"commandId":"cmd-classify-msg-42","dependencyToken":"sha256:94c121802445ebc0ce6e6d2ed1de32fc077696e6ac50b200de0fc2928cd3e524","dispatch":"sha256:526f1d18a3ba9021411ae400447367a2b3aea58ba4c6e05c550695aec9b24a5d","executionProfile":"sha256:7a5f4b351f86d8d2a6706a9f1153426556690848ff59a161da9338070c3d42e4","inputIdentity":"sha256:869d938624bc68bab69059b321ad975db9801ec5178d60816202c8574e4cdad1","manifest":"sha256:f9f8e1ac8453880449e6b897bb9b90071df0c977e81e255b26aa20e788353004","outcome":{"success":{"outputManifest":"sha256:25f64c8d0da27c87e8833cd426e14fd052ca426dabd9e6dba42f83f2543e74be","outputs":[],"summary":{"confidence":0.92,"intent":"order.modify","labels":["order","quantity"]}}},"provenance":{"executor":"pool.wasm.eu-1","placement":"pool-eu-1/node-a","runtime":"sha256:a0198cff775e4ab78371b0ce027929db16f21f9574226f59927ad49c6abc5bc0"},"resources":{"cpuMillis":3,"fuel":182000,"outputBytes":0,"peakMemoryBytes":2097152,"wallMillis":4},"run":{"generation":1,"id":"run-cmd-classify-msg-42"}}
